{
    "$schema": "../../../run-config/schema/agent-settings.schema.json",
    "poolTokenSuffix": "ABCX",
    "vaultCollateralFtsoSymbol": "testUSDC",
    "fee": "0.5%",
    "poolFeeShare": "40%",
    "mintingVaultCollateralRatio": "1.6",
    "mintingPoolCollateralRatio": "2.4",
    "poolExitCollateralRatio": "2.6",
    "buyFAssetByAgentFactor": "0.99",
    "poolTopupCollateralRatio": "2.2",
    "poolTopupTokenPriceFactor": "0.8",
    "handshakeType": 0
}
